自分は嘘をついてしまったと認めた方がいいと思いますよ,じぶんはうそをついてしまったとみとめたほうがいいとおもいますよ
自分は5年で返り咲きました。あなたにも、いずれそういう日がやって来ますよ,じぶんはごねんでかえりざきましたあなたにもいずれそういうにちがやってきますよ
自分一人で判断をした,じぶんひとりではんだんをした
SHINE！,えすえいちあいえぬいー
週刊誌が本当だったら、亀井さんは大変な事になってますよ,しゅうかんしがほんとうだったらかめいさんはたいへんなことになってますよ
10年で国民の総所得を150万円増やしてまいります,いちぜろねんでこくみんのそうしょとくをいちごぜろまんえんふやしてまいります
首相とは長い付き合いだが、今までで最も面白いジョークだ,しゅしょうとはながいつきあいだがいままででもっともおもしろいじょくだ
首脳同士が握手するだけで地域の平和につながる,しゅのうどうしがあくしゅするだけでちいきのへいわにつながる
主の大御神様、救い主様、聖珠様、教え主様,おものおおみかさますくいしゅさまひじりしゅさまおしえしゅさま
春節に際して、更に多くの中国の皆様が訪日されることを楽しみにしています,しゅんせつにさいしてさらにおおくのちゅうごくのみなさまがほうにちされることをたのしみにしています
障害者雇用の短時間勤務職員,しょうがいしゃこようのたんじかんきんむしょくいん
人道上の観点から、資格を有する外国人の方には生活保護を支給しています,じんどううえのかんてんからしかくをゆうするがいこくじんのほうにはせいかつほごをしきゅうしています
新入社員っていうのは失敗するんですよね。,しんにゅうしゃいんっていうのはしっぱいするんですよね
森羅万象,しんらばんしょう
侵略という定義については、これは学界的にも国際的にも定まっていないと言ってもいいんだろうと思うわけでございます,しんりゃくというていぎについてはこれはがっかいてきにもこくさいてきにもさだまっていないといってもいいんだろうとおもうわけでございます
水銀による被害とその克服を経たわれわれだからこそ、世界から水銀の被害をなくすため、先頭に立って力を尽くす責任が日本にはある,すいぎんによるひがいとそのこくふくをへたわれわれだからこそせかいからすいぎんのひがいをなくすためせんとうにたってちからをつくすせきにんがにっぽんにはある
菅ちゃん、頼むよ,かんちゃんたのむよ
菅ちゃん、ちょっとまとめてよ,かんちゃんちょっとまとめてよ
スギハラアダチ,すぎはらあだち
ずぶずぶの関係とかいう品の悪い言葉,ずぶずぶのかんけいとかいうひんのわるいことば
すみません委員長ちょっと外の方がうるさくて,すみませんいいんちょうちょっとそとのほうがうるさくて
政権に都合のいい情報隠蔽は起こらない,せいけんにつごうのいいじょうほういんぺいはおこらない
背後（せいご）,はいごせいご
聖子ちゃんとは何回もハグしてるんだけどね。一杯飲んだら,せいこちゃんとはなんかいもはぐしてるんだけどねいっぱいのんだら
聖子ちゃん、〇〇やってよ,せいこちゃんやってよ
政策の失敗というが、失敗ではなくて、福島委員が政権におられたときよりも20万人、40万人増やしている,せいさくのしっぱいというがしっぱいではなくてふくしまいいんがせいけんにおられたときよりもにぜろばんにんよんぜろばんにんふやしている
政治責任うんぬんというのは理解できない,せいじせきにんうんぬんというのはりかいできない
政治とお金の問題にこれから根本的にメスを入れていくこと そして腐敗を厳しく防止する法律を一刻も早く作ること,せいじとおきんのもんだいにこれからこんぽんてきにめすをいれていくことそしてふはいをいかめしくぼうしするほうりつをいっこくもはやくつくること
政治は結果なんですよ,せいじはけっかなんですよ
政治は未来のためにある,せいじはみらいのためにある
政調会長が説明してくれないと収まりません！,せいちょうかいちょうがせつめいしてくれないとおさまりません
責任…ですかね,せきにんですかね
選挙で当選しなかったから捕まったんだよ（笑）,せんきょでとうせんしなかったからつかまったんだよわらい
選挙のためなら何でもする 誰とも組む 無責任な勢力に負ける訳にはいかない,せんきょのためならなんでもするだれともくむむせきにんなせいりょくにまけるわけにはいかない
税収というのは国民から吸い上げたものでありまして,ぜいしゅうというのはこくみんからすいあげたものでありまして
絶対に捕まらないようにします,ぜったいにつかまらないようにします
全然、ムッとしていないですよ。ただ1か所、気になったところがあった,ぜんぜんむっとしていないですよただいちかところきになったところがあった
先輩がご迷惑をおかけしたことをおわびしなければいけない,せんぱいがごめいわくをおかけしたことをおわびしなければいけない
そういう新しい獣医大学の考えはいいね,そういうあたらしいじゅういだいがくのかんがえはいいね
そういう親も指導しなければ行けない時代に、もう来ているのかなと思う,そういうおやもしどうしなければいけないじだいにもうきているのかなとおもう
そういう子供っぽいことはやめましょうよ,そういうこどもっぽいことはやめましょうよ
相当詳しく読売新聞に書いてありますから,そうとうくわしくよみうりしんぶんにかいてありますから
そうやって印象操作を一生懸命されていますけれども、一生懸命、一生懸命、そうやって一生懸命印象操作をされていますけれども,そうやっていんしょうそうさをいっしょうけんめいされていますけれどもいっしょうけんめいいっしょうけんめいそうやっていっしょうけんめいいんしょうそうさをされていますけれども
総理大臣として事実を述べてはならないということではないんだろう,そうりだいじんとしてじじつをのべてはならないということではないんだろう
総理大臣なので森羅万象全て担当していますから,そうりだいじんなのでしんらばんしょうすべてたんとうしていますから
そこでおいしいおいしいヨーグルトになりたいと思う,そこでおいしいおいしいよぐるとになりたいとおもう
外に出すことを前提にしていない発言,そとにだすことをぜんていにしていないはつげん
その資料はなんだよ,そのしりょうはなんだよ
そのとき社会はあたかもリセット・ボタンを押したようになって、日本の景色は一変するでしょう,そのときしゃかいはあたかもりせっとぼたんをおしたようになってにっぽんのけしきはいっぺんするでしょう
その北方領土については、の島々には、我が国が主権、北方領土の島々は我が国が主権を有する島々であるという立場でございます。,そのほっぽうりょうどについてはのしまにはわがくにがしゅけんほっぽうりょうどのしまはわがくにがしゅけんをゆうするしまであるというたちばでございます
『そもそも』という言葉の意味について、辞書で念のために調べてみたわけでありますが、これは『基本的に』という意味もある,そもそもということばのいみについてじしょでねんのためにしらべてみたわけでありますがこれはきほんてきにといういみもある
それはインフレがどんどん進んでいくという問題、もう1点は円の価値がどんどん暴落していくという問題。,それはいんふれがどんどんすすんでいくというもんだいもういちてんはえんのかちがどんどんぼうらくしていくというもんだい
それは私の事務所に関わることでありますから、担当する大臣から答弁させたいと思います,それはわたしのじむしょにかかわることでありますからたんとうするだいじんからとうべんさせたいとおもいます
そんなことできるはずがないじゃないですか,そんなことできるはずがないじゃないですか
そんなことより、一度は理想の上司と書かれてみたいものであります,そんなことよりいちどはりそうのじょうしとかかれてみたいものであります
そんなに興奮しないでください,そんなにこうふんしないでください
大丈夫だから、私を信じてついて来なさい,だいじょうぶだからわたしをしんじてついてこなさい
大体本当に悪巧みをしようとしたらそんな写真なんか出しませんよ,だいたいほんとうにわるだくみをしようとしたらそんなしゃしんなんかだしませんよ
代表なくして課税なし,だいひょうなくしてかぜいなし
大変、妄想をたくましくしておられますが、そんな事実は全くありません,たいへんもうそうをたくましくしておられますがそんなじじつはまったくありません
大量破壊兵器がないと証明できなかったイラクが悪い,たいりょうはかいへいきがないとしょうめいできなかったいらくがわるい
台湾の大根もだいぶウンチに近いよね,たいわんのだいこんもだいぶうんちにちかいよね
高市早苗を応援しない,たかいちさなえをおうえんしない
高市さんね、夫婦別氏、あれはダメだよ,たかいちさんねふうふべつしあれはだめだよ
高い倫理観を持て,たかいりんりかんをもて
だから、すみませんって言ってるじゃないか,だからすみませんっていってるじゃないか
だから何だってんだ,だからなんだってんだ
出すべきときは出すべきだ,だすべきときはだすべきだ
だって、こ、これに、書い、これに書……これに、これに書いてないじゃないですか？,だってここれにかいこれにかきこれにこれにかいてないじゃないですか
誰かにもらったんだよ,だれかにもらったんだよ
タル,たる
ちなみにですね民主党政権下の三年間は,ちなみにですねみんしゅとうせいけんしたのさんねんかんは
中国は長きにわたり日本のお手本でした,ちゅうごくはながきにわたりにっぽんのおてほんでした
チョーゼバ、イターキマス,ちょぜばいたきます
（お箸クルンッ),おはしくるんっ
ちょっと遺憾だった,ちょっといかんだった
ちょっとトイレ行ってきていい？,ちょっとといれいってきていい
賃上げの花が舞い散る春の風,ちんあげのはながまいちるはるのかぜ
次は菅さんとやり合ってくださいよ,つぎはかんさんとやりあってくださいよ
次は私自身が金正恩委員長と向き合わなければならない,つぎはわたしじしんがかねまさおんいいんちょうとむきあわなければならない
訂正でんでん,ていせいでんでん
ＴＰＰ断固反対と言ったことは一回も、ただの一回もございません,だんこはんたいといったことはいっかいもただのいっかいもございません
できない理由を考えるのではなく！,できないりゆうをかんがえるのではなく
テンドンヘイカ、バンザーイ！,てんどんへいかばんざい
天に対してブーメランを投げているようなものであります,てんにたいしてぶめらんをなげているようなものであります
天皇、皇后両陛下には末永くお健やかであらせられますことを願っていません。,てんのうこうごうりょうへいかにはすえながくおすこやかであらせられますことをねがっていません
同期一の男前は岸田、頭いいのは茂木、性格いいのは安倍,どうきいちのおとこまえはきしだあたまいいのはもてぎせいかくいいのはあべ
東京都大田区の中小企業を経営する細貝さんは、仲間と共に、ボブスレー競技用「そり」の国産化プロジェクトを立ち上げました,とうきょうとおおたくのちゅうしょうきぎょうをけいえいするほそがいさんはなかまとともにぼぶすれきょうぎようそりのこくさんかぷろじぇくとをたちあげました
糖度が高いのでしょうね,とうどがたかいのでしょうね
高い糖度だね,たかいとうどだね
同年代に嫌われたと悲しい思いがする。新聞の愛読者層ではないか,どうねんだいにきらわれたとかなしいおもいがするしんぶんのあいどくしゃそうではないか
トゥマ,とぅま
同盟関係がよければ1＋1が2以上になりますが、同盟関係がなければ1＋1は1にしかならない危険性を持っている,どうめいかんけいがよければいちいちがにいじょうになりますがどうめいかんけいがなければいちいちはいちにしかならないきけんせいをもっている
ときどき疲れた時などわたしたちのことを思い出してください,ときどきつかれたときなどわたしたちのことをおもいだしてください
TOKIOの皆さんに、総理公邸でお目にかかりました,てぃーおーけーあいおーのみなさんにそうりこうていでおめにかかりました
独自に戦った方が、維新らしいんじゃないの？,どくじにたたかったほうがいしんらしいんじゃないの
独自のそのまさに妄想をたくましくしておられて、独自のこの議論をしておられるんだろうと、こう思いますよ。,どくじのそのまさにもうそうをたくましくしておられてどくじのこのぎろんをしておられるんだろうとこうおもいますよ
特定の考え方を持つ人たちのための政治を行うつもりはありません,とくていのかんがえかたをもつにんたちのためのせいじをおこなうつもりはありません
とこやに、行きました。,とこやにいきました
ドナルド、温かい言葉をありがとう。ドナルドの友情に心から感謝します。,どなるどあたたかいことばをありがとうどなるどのゆうじょうにこころからかんしゃします
とにかく徳を積め,とにかくとくをつめ
トランプ氏とプーチン氏はきっとうまが合うと思う,とらんぷしとぷちんしはきっとうまがあうとおもう
トリクルダウンの政策だとあったが私はそんなことは一度も言ったことはない,とりくるだうんのせいさくだとあったがわたしはそんなことはいちどもいったことはない
取り消しなさいと言われても取り消しません,とりけしなさいといわれてもとりけしません
内閣総理大臣がチェック機関としての役割を果たすことに資する組織,ないかくそうりだいじんがちぇっくきかんとしてのやくわりをはたすことにしするそしき
ないものを証明するのは『悪魔の証明』だ！ 調べようがない,ないものをしょうめいするのはあくまのしょうめいだしらべようがない
ないよ、そんなもん,ないよそんなもん
"亡くなられた""ミヤケさん""のような方が町の安全を守っているのだと思います",なくなられたみやけさんのようなほうがまちのあんぜんをまもっているのだとおもいます
７万戸の建物を壊し、一面を、業火と爆風に浚わせ、廃墟と化しました,まんこのたてものをこわしいちめんをごうかとばくふうにしゅんわせはいきょとかしました
何が菅談話だよ、全くばかばかしい,なにがかんだんわだよまったくばかばかしい
波平さんは、私より一つ若いんですね。ですから、五十七歳ですか。,なみへいさんはわたしよりひとつわかいんですねですからごじゅうななさいですか
なるべく冷静にしようと思い、息を４秒吸って、８秒で吐くようにしている,なるべくれいせいにしようとおもいいきをびょうすってびょうではくようにしている
何であなたはそんなにわからず屋なんだ,なんであなたはそんなにわからずやなんだ
逃げて逃げて逃げ回っているようでは国民の負託に応えることはできません,にげてにげてにげまわっているようではこくみんのふたくにこたえることはできません
20度！？,にぜろど
2021年7月23日、東京にラッパが鳴る。,にぜろにいちねんなながつにさんにちとうきょうにらっぱがなる
2020年という節目の年にあたり、世界中に嵐を巻き起こしていただきたい,にぜろにぜろねんというふしめのねんにあたりせかいじゅうにあらしをまきおこしていただきたい
2020年を新しい憲法が施行される年にしたい,にぜろにぜろねんをあたらしいけんぽうがしこうされるねんにしたい
日刊ゲンダイでも読んでみてくださいよ,にっかんげんだいでもよんでみてくださいよ
日教組！日教組！,にっきょうそにっきょうそ
日教組どうすんだ日教組！,にっきょうそどうすんだにっきょうそ
日本が大陸間弾道弾を作っても憲法上問題ない。憲法上は原子爆弾だって問題ない。小型ならば,にっぽんがたいりくかんだんどうだんをつくってもけんぽううえもんだいないけんぽううえはげんしばくだんだってもんだいないこがたならば
日本銀行は政府の子会社ですから,にっぽんぎんこうはせいふのこがいしゃですから
日本人の命、すべからく、国の最高責任者である私にあります,にほんじんのいのちすべからくくにのさいこうせきにんしゃであるわたしにあります
日本とスペインは自由、民主主義、人権、法の支配といった普遍的価値を共有し、世界の平和と発展のために貢献していく大切なパートナーだ,にっぽんとすぺいんはじゆうみんしゅしゅぎじんけんほうのしはいといったふへんてきかちをきょうゆうしせかいのへいわとはってんのためにこうけんしていくたいせつなぱとなだ
日本のイメージは大きく傷ついたわけであります,にっぽんのいめじはおおきくきずついたわけであります
日本の欠点を語ることに生きがいを求めるのではなく、日本の明日のために何をなすべきかを語り合おうではないか。,にっぽんのけってんをかたることにいきがいをもとめるのではなくにっぽんのあしたのためになにをなすべきかをかたりあおうではないか
日本の人口動態は逆説的ですが重荷ではなくボーナスなのです,にっぽんのじんこうどうたいはぎゃくせつてきですがおもにではなくぼなすなのです
日本の未来を担うみなさんへ,にっぽんのみらいをになうみなさんへ
日本は今も、これからも、二級国家にはなりません,にっぽんはいまもこれからもにきゅうこっかにはなりません
日本は昔から差別をするような国ではない,にっぽんはむかしからさべつをするようなくにではない
日本よ、日本人よ、世界の真ん中で咲き誇れ！,にっぽんよにほんじんよせかいのまんなかでさきほこれ
人間としてどうなのかなと,にんげんとしてどうなのかなと
布マスクを確保し、順次必要な枚数を配布してまいります。,ぬのますくをかくほしじゅんじひつようなまいすうをはいふしてまいります
年末に向けて財布のひもをグッと開いてもらいたい,ねんまつにむけてさいふのひもをぐっとひらいてもらいたい
野田さんは安定感がありましたよ,のださんはあんていかんがありましたよ
野田氏が首相になったら、中途半端にまともなだけに攻めにくいな,のだしがしゅしょうになったらちゅうとはんぱにまともなだけにせめにくいな
野田総理、いつもこんななんですよ。いつもこんななんです。,のだそうりいつもこんななんですよいつもこんななんです
Buy my Abenomics,びーゆーわいえむわいえーびーいーえぬおーえむあいしーえす
バカみたいな質問だな、いつも,ばかみたいなしつもんだないつも
バクシンの友,ばくしんのとも
パクチー栽培を行うため、東京から移住してきました,ぱくちさいばいをおこなうためとうきょうからいじゅうしてきました
800円で大臣を辞めさせるのですか,はちぜろぜろえんでだいじんをやめさせるのですか
はっぴを着てハッピー,はっぴをきてはっぴ
早く質問しろよ,はやくしつもんしろよ
林さんは中国のハニートラップにかかってるでしょうね,はやしさんはちゅうごくのはにとらっぷにかかってるでしょうね
韓鶴子総裁をはじめ皆さまに敬意を表します。,かんつるこそうさいをはじめみなさまにけいいをあらわします
パンプスの着用を強制するのは許されない,ぱんぷすのちゃくようをきょうせいするのはゆるされない
非常にしつこい,ひじょうにしつこい
非常にジューシー,ひじょうにじゅし
非常に生乳たっぷり,ひじょうにせいにゅうたっぷり
"""非正規""という言葉をこの国から一掃してまいります",ひせいきということばをこのくにからいっそうしてまいります
一つだけ大きなミスを犯してしまいました。エレベーターまでつけてしまいました,ひとつだけおおきなみすをおかしてしまいましたえれべたまでつけてしまいました
人として根本的にダメだ,にんとしてこんぽんてきにだめだ
人に対して威張ったり、地位を利用して従わせるのではなく、まず自分の人格や魅力を磨くのが大事,にんにたいしていばったりちいをりようしてしたがわせるのではなくまずじぶんのじんかくやみりょくをみがくのがだいじ
批判を受ければ受けるほどやってやろうという闘志が湧いてきます,ひはんをうければうけるほどやってやろうというとうしがわいてきます
批評するだけの人間に価値はありません,ひひょうするだけのにんげんにかちはありません
100の言葉より1の結果であります,いちぜろぜろのことばよりいちのけっかであります
貧乳時代宣言をここに発令いたします,ひんにゅうじだいせんげんをここにはつれいいたします
(夫婦別姓に)反対している人がいるんだよねー,ふうふべっせいにはんたいしているにんがいるんだよね
フジサンケイグループの皆さまに改めて敬意を表します,ふじさんけいぐるぷのみなさまにあらためてけいいをあらわします
復興五輪と言うべき本年のオリンピック・パラリンピックなどの機会を通じて、復興しつつある被災地の姿を実感していただきたい,ふっこうごりんというべきほんねんのおりんぴっくぱらりんぴっくなどのきかいをつうじてふっこうしつつあるひさいちのすがたをじっかんしていただきたい
不毛なレッテル貼りはやめお互いに政策論争をしていきましょう,ふもうなれってるはりはやめおたがいにせいさくろんそうをしていきましょう
"Please, look at me.",ぴーえるいーえーえすいーえるおーおーけーえーてぃーえむいー
ぷりぷり。元気が出そう,ぷりぷりげんきがだそう
